{
  "$schema": "https://json-schema.org/draft/2020-12/schema",
  "$id": "https://docs.interfaze.gg/schema/translations/v1.json",
  "title": "Interfaze Translations",
  "description": "Format intermédiaire des traductions d'un workspace. Une clé = un texte traduisible, scoped au workspace (pas de partage entre admins). Référencée depuis les menus et commandes via {i18n:<key>}. Le contenu de chaque traduction est du MiniMessage (cf. https://docs.advntr.dev/minimessage/).",
  "type": "object",
  "additionalProperties": false,
  "required": ["schema", "default_lang", "languages", "keys"],
  "properties": {
    "schema": {
      "const": "translations/v1",
      "description": "Version du schéma. Verrouillée pour permettre les migrations applicables au load."
    },
    "default_lang": {
      "$ref": "#/$defs/LangCode",
      "description": "Code de la langue de référence du workspace. Toute clé doit avoir au minimum cette langue. Fallback ultime si une autre langue manque."
    },
    "languages": {
      "type": "array",
      "items": { "$ref": "#/$defs/LangCode" },
      "minItems": 1,
      "uniqueItems": true,
      "description": "Liste des langues supportées par le workspace. Doit contenir default_lang. Une langue listée mais sans valeur pour une clé donnée → fallback à default_lang à l'exécution (warning dans l'éditeur)."
    },
    "keys": {
      "type": "object",
      "patternProperties": {
        "^[a-z][a-z0-9_]*(\\.[a-z0-9_]+)*$": {
          "type": "object",
          "patternProperties": {
            "^[a-z]{2,3}(?:_[A-Za-z]{2,4})?$": {
              "type": "string",
              "maxLength": 4096,
              "description": "Valeur de la clé pour cette langue. Format MiniMessage. Peut contenir des placeholders PAPI (%player_name%) et d'autres références i18n ({i18n:autre.cle})."
            }
          },
          "additionalProperties": false,
          "minProperties": 1,
          "description": "Map langue → valeur pour cette clé. Doit contenir au minimum la default_lang."
        }
      },
      "additionalProperties": false,
      "description": "Toutes les clés du workspace, chacune avec un map de traductions par langue. Le pattern de clé impose un slug hiérarchique avec '.' (ex: menu.shop_main.btn_buy.title)."
    },
    "metadata": {
      "type": "object",
      "additionalProperties": true,
      "description": "Métadonnées calculées par le backend. Non éditées manuellement.",
      "properties": {
        "created_at": { "type": "string", "format": "date-time" },
        "updated_at": { "type": "string", "format": "date-time" },
        "key_count": { "type": "integer", "minimum": 0 }
      }
    }
  },
  "$defs": {
    "LangCode": {
      "type": "string",
      "pattern": "^[a-z]{2,3}(?:_[A-Za-z]{2,4})?$",
      "description": "Code de langue style ISO 639-1/3 avec optional region (BCP-47-like). Exemples : fr, en, en_US, en_GB, de, es, pt_BR, zh_CN, fil. Lowercase pour la lang, optional underscore + region (any case)."
    }
  }
}
